restaurant_name,comment_text,date,rating
فست فود بارکد,غذا بسیار خوش مزه و داغ و سر موقع رسید,۲۱ شهریور ۱۴۰۴,5
فست فود بارکد,عالی بود ممنون. هم طعم هم کیفیت,۱۲ مرداد ۱۴۰۴,5
فست فود بارکد,عالی بود,۱۴ تیر ۱۴۰۴,5
فست فود بارکد,خیلی خمیر کلفت و نپخته ایی داشت همشم خمیر بود و پنیر بدون هیچ موادی استیکا سوخته و خشک بودن در کل نسبت به قیمت اصلا نمی ارزه,۹ خرداد ۱۴۰۴,
فست فود بارکد,خوب بود ولي عالي نبود,۲۲ فروردین ۱۴۰۴,4
فست فود بارکد,کیفیت بسیار پایین قیمت بالا نسبت به کیفیت,۱۴ دی ۱۴۰۳,
فست فود بارکد,عالی عالی عالی,۱۴ شهریور ۱۴۰۰,5
فست فود بارکد,نان سیر عالی بود. طعم پیتزا خوب بود کمی موادش نسبت به حجم پیتزا کم بود.,۲۴ دی ۱۳۹۹,4
فست فود بارکد,سفارش به موقع رسید ولی کمی سرد بود به نسبت یک پیتزای ۶۹۵۰۰ تومانی خیلی انتخاب های بهتری میشد کرد. نون پیتزا خیلی نرم بود محتویات و طعم در حد انتظار نبود,۳ مهر ۱۳۹۹,3
فست فود بارکد,قابل خوردن نبود ، زیر پیتزا سوخته و سیاه خود پیتزا خمیر و وا رفته . تعداد قارچ هم به ۱۰ تا نمیرسید برخورد تلفنی خیلی بدیم داشتن. اخرین سفارشم بود,۲ مرداد ۱۳۹۸,
فست فود بارکد,فيلادلفيا عاااالي بود محشر ممنونم,۲۵ اسفند ۱۳۹۷,
فست فود بارکد,خیلی خوب بود .,۲۲ دی ۱۳۹۷,
کافه پیتزا ناپولیتن,غذا رو اشتباه فرستاده بودند ولی در کل خوب بود,۳۰ مهر ۱۴۰۴,4
کافه پیتزا ناپولیتن,اصلا پیشنهاد نمیشه عدم تناسب قیمت و کیفیت,۲۶ مهر ۱۴۰۴,
کافه پیتزا ناپولیتن,افتضاح بود,۳ مرداد ۱۴۰۴,
کافه پیتزا ناپولیتن,پیک فوق العاده مودب بود.,۱۹ بهمن ۱۴۰۳,4
کافه پیتزا ناپولیتن,طعمش افتضاح بود بسیار سرد,۲ آذر ۱۴۰۳,
پیتزا پرپروک (پاسداران - شبانه),قبلا خیلی بهتر بود ولی متأسفانه کیفیت بسیار پایین آمده,۸ اردیبهشت ۱۴۰۲,3
پیتزا پرپروک (پاسداران - شبانه),از همه لحاظ عالی من از خیلی جاها غذا گرفتم و کار خودمم تو رستوران واقعا بهتون رابطه عالی میدم همیشه از غذاهایی که سفارش دادم راضی بودم کلا نظر نمیدم ولی اینسری گفتم حتما تشکر کنم,۲۳ بهمن ۱۴۰۱,5
فست فود بارکد,مثل همیشه گرم و عالی.,۲۹ مهر ۱۴۰۴,5
فست فود بارکد,مثل همیشه عالی و گرم به دستم رسید .,۲۲ مهر ۱۴۰۴,5
فست فود بارکد,عالی و درجه یک,۳۱ شهریور ۱۴۰۴,5
فست فود بارکد,خیلی خوشمزه بود. تشکر,۱۳ شهریور ۱۴۰۴,5
فست فود بارکد,پیتزا با این قیمت بسیار کوچک هست ۱ بچه رو هم سیر نمیکنه,۵ شهریور ۱۴۰۴,3
فست فود بارکد,بسیار عالی,۵ شهریور ۱۴۰۴,5
فست فود بارکد,بدترین پیتزای استیکی که اخیرا سفارش دادم. گوشت مونده، خشک و بی طعم. خمیر پیتزا واقعا بی کیفیت. اصلا راا,۴ شهریور ۱۴۰۴,
فست فود بارکد,کیفیت خوبی داره. من اکثرا حضوری یا تلفنی سفارش می دم ولی با اسنپ هم سفارش دادم سریع و گرم به دستم رسید. ممنون از مدیریت خوب بارکد,۳ شهریور ۱۴۰۴,5
فست فود بارکد,خیلی خیلی خوب و داغ,۱۱ مرداد ۱۴۰۴,5
فست فود بارکد,طعم عالی سریع هم ارسال شد مرسی,۱ تیر ۱۴۰۴,5
فست فود بارکد,ممنون غذاتون گرم و به موقع به دستم رسید ،کیفیت غذاتون عالیه ،سالاد هم خیلی سایزش مناسب و مرغشم خوشمزه بود,۷ اسفند ۱۴۰۳,5
فست فود بارکد,ابعد از مدتها خوشحال و امیدوار شدم که هنوز رستورانهایی هستند که کیفیت براشون مهمه و قطعا پیشنهاد می کنم امتحان کنید و لذت ببرید,۵ اسفند ۱۴۰۳,5
فست فود بارکد,جز خاص ترین برگرهایی که خوردم طعم واقعی گوشت بود پیتزا استیک مثل همیشه عالی بود,۱۵ مهر ۱۴۰۳,5
فست فود بارکد,کیفیت خوب بود و گرم به دستم رسید,۲۹ مرداد ۱۴۰۳,5
فست فود بارکد,خوشمزه، باکیفیت، قیمتِ متناسب,۲ آذر ۱۴۰۲,4
فست فود بارکد,عالی,۱۸ شهریور ۱۴۰۲,5
فست فود بارکد,عالی,۱۵ شهریور ۱۴۰۲,5
فست فود بارکد,واقعا مثل همیشه عالی بود من واسه تحویل عجله داشتم و با وجود شلوغی در اولین زمان ممکن برام ارسال شد عالی,۲۲ آبان ۱۴۰۴,5
